<?xml version="1.0" encoding="UTF-8"?>
<Tests xmlns:xsi="http://www.w3.org/2001/XMLSchema-instance" xsi:noNamespaceSchemaLocation="FourCC-validation.xsd">

	<!-- a selection of valies from mp4ra.org -->
	<FourCC>Mp4a</FourCC>
	<FourCC>caac</FourCC>
	<FourCC>3gp4</FourCC>
	<FourCC>dxo </FourCC>
	<FourCC>jxl </FourCC>
	<FourCC>qt  </FourCC>
	<FourCC>XAVC</FourCC>
	<FourCC>mpd </FourCC>
	<FourCC>MPEG</FourCC>
	<FourCC>uri </FourCC>
	<FourCC>jsxH</FourCC>
	<FourCC>rICC</FourCC>
	<FourCC>sha1</FourCC>
</Tests>

